{
    "contactInfo": {
        "fullName": "Luis Abel Pozuelos Juarez",
        "emailAddress": "lpozuelos@irc.com.gt"
    },
    "github": {
        "profileURL": "https://github.com/blindlp",
        "username": "blindlp"
    },
    "credentials": {
        "password": ""
    },
    "personalInfo": {
        "questions": [
            {
                "question": "If I was a Sr. Programmer, I would like to build:",
                "answer": "I create new application to bring more easily to solve problems in my field,sharing my knowledge  and I trying to find new opportunities to develop business and create new sources of work."
            },
            {
                "question": "Por favor indica el URL que me lleva a la línea de código de la definición de React.useEffect",
                "answer": "https://es.reactjs.org/docs/hooks-reference.html#useeffect "
            },
            {
                "question": "code is poetry, because:",
                "answer": "it's poetry because you need to have different feelings to create and develop your abilities, I think is a king of art the way we express our code because its unique everybody has his own style"
            }
        ]
    }
}
